keyword,volume_range,competition_level,opportunity_score,niche,date_found
alternative to allergy shots,100-1000,low,3,podcast generators,2026-04-06
alternative to amber crossword clue,100-1000,low,3,podcast generators,2026-04-06
alternative to bath and body works,100-1000,low,3,podcast generators,2026-04-06
alternative to cable kickbacks,100-1000,low,3,podcast generators,2026-04-06
alternative to cinema app,100-1000,low,3,podcast generators,2026-04-06
alternative to estrogen patch,100-1000,low,3,podcast generators,2026-04-06
alternative to hearing aids,100-1000,low,3,podcast generators,2026-04-06
alternative to kratom,100-1000,low,3,podcast generators,2026-04-06
alternative to legos,100-1000,low,3,podcast generators,2026-04-06
alternative to levi's crossword,100-1000,low,3,podcast generators,2026-04-06
alternative to levis,100-1000,low,3,podcast generators,2026-04-06
alternative to licking envelopes,100-1000,low,3,podcast generators,2026-04-06
alternative to lsat,100-1000,low,3,podcast generators,2026-04-06
alternative to meloxicam,100-1000,low,3,podcast generators,2026-04-06
alternative to mrs rachel,100-1000,low,3,podcast generators,2026-04-06
alternative to shoulder press,100-1000,low,3,podcast generators,2026-04-06
alternative to shoulder replacement,100-1000,low,3,podcast generators,2026-04-06
alternative to teal crossword,100-1000,low,3,podcast generators,2026-04-06
alternative to whey protein,100-1000,low,3,podcast generators,2026-04-06
tts influencer,1000-5000,medium,3,podcast generators,2026-04-06
tts models,1000-5000,medium,3,podcast generators,2026-04-06